[
  {
    "id": "bh-f1-17-00",
    "image": "assets/photos/bh-f1-17-00/image.webp",
    "thumbnail": "assets/photos/bh-f1-17-00/thumb.webp",
    "originalImage": "assets/photos/bh-f1-17-00/original.jpg",
    "title": "Torque-tube mounting saddle",
    "caption": "Torque-tube mounting saddle",
    "whyUseful": "Shows the saddle sitting over a fuselage mounting tab and the nearby cable path, useful for separating the mounting relationship from removable floor panels.",
    "aircraftModel": "Unknown",
    "aircraftSerial": "",
    "builder": "Uncredited factory-manual example",
    "section": "Fuselage",
    "subsystem": "Controls",
    "component": "Control Sticks",
    "buildStage": "Before covering",
    "viewpoint": [],
    "tags": [
      "detail",
      "before-covering",
      "legacy-kit"
    ],
    "sourceType": "Bearhawk Factory",
    "sourceName": "Bearhawk / AviPro · Legacy Fuselage Manual",
    "sourceUrl": "https://www.bearhawkaircraft.com/s/BHManual-Fuselage1-25Rev1.pdf",
    "sourcePage": "PDF p17",
    "sourceDocument": "BHManual-Fuselage1-25Rev1.pdf",
    "originalFilename": "Im29.jpg",
    "originalPath": "BHManual-Fuselage1-25Rev1.pdf/page-17/Im29.jpg",
    "originalCaption": "",
    "authorityLevel": 3,
    "stockOrModified": "Unknown",
    "classification": "UNKNOWN",
    "applicabilityNotes": "The photographed aircraft model is not identified. Use for local visual relationships only; verify applicability to the Companion. The manual discusses floorboard and mount variations; this is not a drilling or nut-modification instruction.",
    "copyrightNotes": "Bearhawk / AviPro source attribution retained. Selected image extracted from the user-provided project manual; no general redistribution license asserted.",
    "rightsBasis": "project-provided selection",
    "reviewStatus": "curated",
    "reviewedBy": "Codex visual/source review",
    "reviewedAt": "2026-09-13",
    "reviewNotes": "Selected initial example authorized by the project brief. Component inspected against the source page; unknown model/stock identity remains explicit.",
    "width": 563,
    "height": 301,
    "sha256": "43ae7dd51c9576ee95ebc4ef6c742c0072515eaafd99ea7e92ec0184b8ce6607",
    "category": "fuselage/controls/control-sticks",
    "guideIds": [
      "CTRL001"
    ],
    "evidence": [
      {
        "type": "source-page",
        "reference": "BHManual-Fuselage1-25Rev1.pdf p17"
      }
    ]
  },
  {
    "id": "bh-f1-17-01",
    "image": "assets/photos/bh-f1-17-01/image.webp",
    "thumbnail": "assets/photos/bh-f1-17-01/thumb.webp",
    "originalImage": "assets/photos/bh-f1-17-01/original.jpg",
    "title": "Control assembly in the cabin",
    "caption": "Control assembly in the cabin",
    "whyUseful": "An oblique cabin view connects the stick sockets, torque tube and pushrod to the surrounding seat and floor structure.",
    "aircraftModel": "Unknown",
    "aircraftSerial": "",
    "builder": "Uncredited factory-manual example",
    "section": "Fuselage",
    "subsystem": "Controls",
    "component": "Control Sticks",
    "buildStage": "Before covering",
    "viewpoint": [],
    "tags": [
      "overview",
      "before-covering",
      "legacy-kit"
    ],
    "sourceType": "Bearhawk Factory",
    "sourceName": "Bearhawk / AviPro · Legacy Fuselage Manual",
    "sourceUrl": "https://www.bearhawkaircraft.com/s/BHManual-Fuselage1-25Rev1.pdf",
    "sourcePage": "PDF p17",
    "sourceDocument": "BHManual-Fuselage1-25Rev1.pdf",
    "originalFilename": "Im27.jpg",
    "originalPath": "BHManual-Fuselage1-25Rev1.pdf/page-17/Im27.jpg",
    "originalCaption": "",
    "authorityLevel": 3,
    "stockOrModified": "Unknown",
    "classification": "UNKNOWN",
    "applicabilityNotes": "The photographed aircraft model is not identified. Use for local visual relationships only; verify applicability to the Companion. The manual discusses floorboard and mount variations; this is not a drilling or nut-modification instruction.",
    "copyrightNotes": "Bearhawk / AviPro source attribution retained. Selected image extracted from the user-provided project manual; no general redistribution license asserted.",
    "rightsBasis": "project-provided selection",
    "reviewStatus": "curated",
    "reviewedBy": "Codex visual/source review",
    "reviewedAt": "2026-09-13",
    "reviewNotes": "Selected initial example authorized by the project brief. Component inspected against the source page; unknown model/stock identity remains explicit.",
    "width": 614,
    "height": 409,
    "sha256": "258d9e52f67aab036ac1d59e0cac2446fec125842cce094dac6d17a1e118676f",
    "category": "fuselage/controls/control-sticks",
    "guideIds": [
      "CTRL001"
    ],
    "evidence": [
      {
        "type": "source-page",
        "reference": "BHManual-Fuselage1-25Rev1.pdf p17"
      }
    ]
  },
  {
    "id": "bh-f1-18-00",
    "image": "assets/photos/bh-f1-18-00/image.webp",
    "thumbnail": "assets/photos/bh-f1-18-00/thumb.webp",
    "originalImage": "assets/photos/bh-f1-18-00/original.jpg",
    "title": "Bellcrank from left and rear",
    "caption": "Bellcrank from left and rear",
    "whyUseful": "The source identifies a left-rear viewpoint: the vertical bellcrank, pushrod connection and nearby flap mechanism can be compared in one view.",
    "aircraftModel": "Unknown",
    "aircraftSerial": "",
    "builder": "Uncredited factory-manual example",
    "section": "Fuselage",
    "subsystem": "Controls",
    "component": "Elevator Bellcrank",
    "buildStage": "Assembly",
    "viewpoint": [
      "left-side",
      "aft"
    ],
    "tags": [
      "left-side",
      "aft",
      "detail",
      "legacy-kit"
    ],
    "sourceType": "Bearhawk Factory",
    "sourceName": "Bearhawk / AviPro · Legacy Fuselage Manual",
    "sourceUrl": "https://www.bearhawkaircraft.com/s/BHManual-Fuselage1-25Rev1.pdf",
    "sourcePage": "PDF p18",
    "sourceDocument": "BHManual-Fuselage1-25Rev1.pdf",
    "originalFilename": "Im30.jpg",
    "originalPath": "BHManual-Fuselage1-25Rev1.pdf/page-18/Im30.jpg",
    "originalCaption": "Elevator bellcrank as seen from left, rear: Use tubing spacersto move it slightly off center to avoid interference with flapcable. Cable from top of bellcrank goes to the left pulley behindit and bottom cable goes through the middle pulley.",
    "authorityLevel": 3,
    "stockOrModified": "Unknown",
    "classification": "UNKNOWN",
    "applicabilityNotes": "The photographed aircraft model is not identified. Use for local visual relationships only; verify applicability to the Companion. The original caption is historical manual text, not current Companion hardware or rigging guidance.",
    "copyrightNotes": "Bearhawk / AviPro source attribution retained. Selected image extracted from the user-provided project manual; no general redistribution license asserted.",
    "rightsBasis": "project-provided selection",
    "reviewStatus": "curated",
    "reviewedBy": "Codex visual/source review",
    "reviewedAt": "2026-09-13",
    "reviewNotes": "Selected initial example authorized by the project brief. Component inspected against the source page; unknown model/stock identity remains explicit.",
    "width": 273,
    "height": 357,
    "sha256": "71711758a96a401f9de438bff314473b880a53a1b8387324879b4f71aa07ead6",
    "category": "fuselage/controls/elevator-bellcrank",
    "guideIds": [
      "CTRL001"
    ],
    "evidence": [
      {
        "type": "source-page",
        "reference": "BHManual-Fuselage1-25Rev1.pdf p18"
      }
    ]
  },
  {
    "id": "bh-f1-19-00",
    "image": "assets/photos/bh-f1-19-00/image.webp",
    "thumbnail": "assets/photos/bh-f1-19-00/thumb.webp",
    "originalImage": "assets/photos/bh-f1-19-00/original.jpg",
    "title": "Pedals and hose clearance",
    "caption": "Pedals and hose clearance",
    "whyUseful": "Front-facing pedal and cylinder relationships are visible beside the firewall; useful for reviewing hose clearance around moving pedals.",
    "aircraftModel": "Unknown",
    "aircraftSerial": "",
    "builder": "Uncredited factory-manual example",
    "section": "Fuselage",
    "subsystem": "Controls",
    "component": "Rudder Pedals",
    "buildStage": "Assembly",
    "viewpoint": [],
    "tags": [
      "overview",
      "routing",
      "legacy-kit"
    ],
    "sourceType": "Bearhawk Factory",
    "sourceName": "Bearhawk / AviPro · Legacy Fuselage Manual",
    "sourceUrl": "https://www.bearhawkaircraft.com/s/BHManual-Fuselage1-25Rev1.pdf",
    "sourcePage": "PDF p19",
    "sourceDocument": "BHManual-Fuselage1-25Rev1.pdf",
    "originalFilename": "Im34.jpg",
    "originalPath": "BHManual-Fuselage1-25Rev1.pdf/page-19/Im34.jpg",
    "originalCaption": "",
    "authorityLevel": 3,
    "stockOrModified": "Unknown",
    "classification": "UNKNOWN",
    "applicabilityNotes": "The photographed aircraft model is not identified. Use for local visual relationships only; verify applicability to the Companion. Historical cylinders and plumbing are not a current brake-parts recommendation; check factory AD-002.",
    "copyrightNotes": "Bearhawk / AviPro source attribution retained. Selected image extracted from the user-provided project manual; no general redistribution license asserted.",
    "rightsBasis": "project-provided selection",
    "reviewStatus": "curated",
    "reviewedBy": "Codex visual/source review",
    "reviewedAt": "2026-09-13",
    "reviewNotes": "Selected initial example authorized by the project brief. Component inspected against the source page; unknown model/stock identity remains explicit.",
    "width": 432,
    "height": 324,
    "sha256": "9eec4b7bc3ec4e61c5699676c8f9d762e2f1a9ee3a8f8d02cdf2ff1e8f4f7cd7",
    "category": "fuselage/controls/rudder-pedals",
    "guideIds": [
      "CTRL002"
    ],